inline const char* bars_xml = R"===(<?xml version="1.0"?>
<!DOCTYPE GeneratorDefinitions SYSTEM "gen.dtd">
<GeneratorDefinitions>
	<gen class="wxStatusBar" image="statusbar" type="statusbar">
		<inherits class="wxWindow" />
		<inherits class="Window Events" />
		<property name="var_name" type="string">m_statusBar</property>
		<property name="class_access" type="option">
			<option name="none" />
			<option name="protected:" />
			<option name="public:" />
			protected:
		</property>
		<property name="fields" type="uint"
			help="Number of fields in the statusbar.">1</property>
		<property name="style" type="bitlist">
			<option name="wxSTB_SIZEGRIP"
				help="Displays a gripper at the right-hand side of the status bar which can be used to resize the parent window." />
			<option name="wxSTB_SHOW_TIPS"
				help="Displays tooltips for those panes whose status text has been ellipsized/truncated because the status text doesn't fit the pane width. Note that this style has effect only on wxGTK (with GTK+ >= 2.12) currently." />
			<option name="wxSTB_ELLIPSIZE_START"
				help="Replace the beginning of the status texts with an ellipsis when the status text widths exceed the status bar pane's widths (uses wxControl::Ellipsize)." />
			<option name="wxSTB_ELLIPSIZE_MIDDLE"
				help="Replace the middle of the status texts with an ellipsis when the status text widths exceed the status bar pane's widths (uses wxControl::Ellipsize)." />
			<option name="wxSTB_ELLIPSIZE_END"
				help="Replace the end of the status texts with an ellipsis when the status text widths exceed the status bar pane's widths (uses wxControl::Ellipsize)." />
			<option name="wxSTB_DEFAULT_STYLE"
				help="The default style: includes wxSTB_SIZEGRIP | wxSTB_SHOW_TIPS | wxSTB_ELLIPSIZE_END | wxFULL_REPAINT_ON_RESIZE" />
			wxSTB_DEFAULT_STYLE
		</property>
	</gen>

	<gen class="wxInfoBar" image="infobar" type="widget">
		<inherits class="wxWindow" />
		<inherits class="Window Events" />
		<inherits class="sizer_child" />
		<property name="var_name" type="string">m_infoBar</property>
		<property name="show_effect" type="option"
			help="Set the effects to use when showing the bar.">
			<option name="wxSHOW_EFFECT_NONE"
				help="No effect, equivalent to normal wxWindow::Show() or Hide() call." />
			<option name="wxSHOW_EFFECT_ROLL_TO_LEFT"
				help="Roll window to the left." />
			<option name="wxSHOW_EFFECT_ROLL_TO_RIGHT"
				help="Roll window to the right." />
			<option name="wxSHOW_EFFECT_ROLL_TO_TOP"
				help="Roll window to the top." />
			<option name="wxSHOW_EFFECT_ROLL_TO_BOTTOM"
				help="Roll window to the bottom." />
			<option name="wxSHOW_EFFECT_SLIDE_TO_LEFT"
				help="Slide window to the left." />
			<option name="wxSHOW_EFFECT_SLIDE_TO_RIGHT"
				help="Slide window to the right." />
			<option name="wxSHOW_EFFECT_SLIDE_TO_TOP"
				help="Slide window to the top." />
			<option name="wxSHOW_EFFECT_SLIDE_TO_BOTTOM"
				help="Slide window to the bottom." />
			<option name="wxSHOW_EFFECT_BLEND"
				help="Fade in or out effect." />
			<option name="wxSHOW_EFFECT_EXPAND"
				help="Expanding or collapsing effect." />
			wxSHOW_EFFECT_NONE
		</property>
		<property name="hide_effect" type="option"
			help="Set the effects to use when hiding the bar. ">
			<option name="wxSHOW_EFFECT_NONE"
				help="No effect, equivalent to normal wxWindow::Show() or Hide() call." />
			<option name="wxSHOW_EFFECT_ROLL_TO_LEFT"
				help="Roll window to the left." />
			<option name="wxSHOW_EFFECT_ROLL_TO_RIGHT"
				help="Roll window to the right." />
			<option name="wxSHOW_EFFECT_ROLL_TO_TOP"
				help="Roll window to the top." />
			<option name="wxSHOW_EFFECT_ROLL_TO_BOTTOM"
				help="Roll window to the bottom." />
			<option name="wxSHOW_EFFECT_SLIDE_TO_LEFT"
				help="Slide window to the left." />
			<option name="wxSHOW_EFFECT_SLIDE_TO_RIGHT"
				help="Slide window to the right." />
			<option name="wxSHOW_EFFECT_SLIDE_TO_TOP"
				help="Slide window to the top." />
			<option name="wxSHOW_EFFECT_SLIDE_TO_BOTTOM"
				help="Slide window to the bottom." />
			<option name="wxSHOW_EFFECT_BLEND"
				help="Fade in or out effect." />
			<option name="wxSHOW_EFFECT_EXPAND"
				help="Expanding or collapsing effect." />
			wxSHOW_EFFECT_NONE
		</property>
		<property name="duration" type="int"
			help="Set the duration of the animation (in milliseconds) used when showing or hiding the bar.">500</property>
	</gen>
</GeneratorDefinitions>)===";
