inline const char* project_xml = R"===(<?xml version="1.0"?>
<!DOCTYPE GeneratorDefinitions SYSTEM "gen.dtd">
<GeneratorDefinitions>
	<gen class="Project" type="project" image="project">
		<inherits class="C++" />
		<inherits class="wxPython" />
		<inherits class="wxRuby" />
		<inherits class="wxGo" />
		<inherits class="wxLua" />
		<inherits class="wxPerl" />
		<inherits class="wxRust" />
		<inherits class="XRC" />
		<property name="code_preference" type="option"
			help="Specify the code you prefer to generate. This can affect default settings for variable names, various initial UI states, and the UI display in the Mockup panel.">
			<option name="C++" />
			<option name="Python" />
			<option name="Ruby" />
			<option name="XRC" />
			C++
		</property>
		<property name="art_directory" type="path"
			help="The directory containing your images (png, ico, xpm, etc.).">./</property>
		<property name="internationalize" type="bool"
			help="Wrap strings in a _() macro.">0</property>
		<property name="help_provider" type="option"
			help="The class of help provider to use for context-sensitive help.">
			<option name="none"
				help="No support for context-sensitive help." />
			<option name="wxSimpleHelpProvider"
				help="Use wxSimpleHelpProvider to provide context-sensitive help." />
			<option name="wxHelpControllerHelpProvider"
				help="Use wxHelpControllerHelpProvider to provide context-sensitive help." />
			none
		</property>
		<property name="id_prefixes" type="stringlist_semi"
			help="Optional prefixes to apply before a custom id. These can be added in the ID Editor dialog." />
		<property name="id_suffixes" type="stringlist_semi"
			help="Optional suffixes to apply after a custom id. These can be added in the ID Editor dialog." />
	</gen>

	<gen class="folder" image="folder" type="folder">
		<inherits class="Folder C++ Overrides" />
		<inherits class="Folder wxPython Overrides" />
		<inherits class="Folder wxRuby Overrides" />
		<inherits class="Folder XRC Overrides" />
		<property name="label" type="string"
			help="The name of the folder.">my_forms</property>
		<property name="code_preference" type="option"
			help="Specify the code you prefer to generate. This can affect default settings for variable names, various initial UI states, and the UI display in the Mockup panel.">
			<option name="C++" />
			<option name="Python" />
			<option name="Ruby" />
			<option name="XRC" />
			C++
		</property>
	</gen>

	<gen class="sub_folder" image="folder" type="sub_folder">
		<property name="label" type="string"
			help="The name of the folder.">my_forms</property>
	</gen>
</GeneratorDefinitions>)===";
