inline const char* grid_xml = R"===(<?xml version="1.0"?>
<!DOCTYPE GeneratorDefinitions SYSTEM "gen.dtd">
<GeneratorDefinitions>
	<gen class="wxGrid" image="grid" type="widget">
		<inherits class="wxWindow" />
		<inherits class="Window Events" />
		<inherits class="sizer_child" />
		<property name="var_name" type="string">m_grid</property>
		<property name="class_access" type="option">
			<option name="none" />
			<option name="protected:" />
			<option name="public:" />
			protected:
		</property>
		<property name="rows" type="uint"
			help="Number of Rows.">5</property>
		<property name="cols" type="uint"
			help="Number of Columns.">5</property>
		<property name="editing" type="bool"
			help="Allow editing grid contents.">1</property>
		<property name="grid_lines" type="bool"
			help="Show grid lines.">1</property>
		<property name="grid_line_color" type="wxColour"
			help="The colour used to draw grid lines." />
		<property name="drag_grid_size" type="bool"
			help="Allow sizing rows and columns by dragging gridlines.">0</property>
		<property name="margin_width" type="uint"
			help="Sets the extra width to display arouned the grid.">0</property>
		<property name="margin_height" type="uint"
			help="Sets the extra height to displaye around the grid.">0</property>
		<property name="selection_mode" type="option">
			<option name="wxGridSelectCells"
				help="Select individual cells as well as of the entire rows and columns. This is the default." />
			<option name="wxGridSelectColumns"
				help="Select entire columns only." />
			<option name="wxGridSelectRows"
				help="Select entire rows only." />
			<option name="wxGridSelectRowsOrColumns"
				help="Select either the entire columns or the entire rows but not individual cells nor blocks." />
			<option name="wxGridSelectNone"
				help="No selections can be made. The user won't be able to select any cells in this mode. Available since dgets 3.1.5" />
			wxGridSelectCells
		</property>

		<category name="Labels">
			<property name="native_col_header" type="bool"
				help="If true, a wxHeaderCtrl is used instead to display the column labels instead of drawing them in wxGrid code itself.">0</property>
			<property name="native_col_labels" type="bool"
				help="If true, column labels use a native look by calling wxRendererNative::DrawHeaderButton() internally. This option is ignored if native_col_header is set to true." />
			<property name="label_bg" type="wxColour"
				help="Background color for row and column labels." />
			<property name="label_font" type="wxFont"
				help="Font for row and column labels." />
			<property name="label_text" type="wxColour"
				help="Colour for row and column label text." />
		</category>

		<category name="Cells">
			<property name="cell_bg" type="wxColour"
				help="Default cell background color." />
			<property name="cell_font" type="wxFont"
				help="Default cell font." />
			<property name="cell_text" type="wxColour"
				help="Default cell text color." />
			<property name="cell_horiz_alignment" type="option"
				help="Default horizontal alignment of cell values.">
				<option name="wxALIGN_LEFT"
					help="Align left." />
				<option name="wxALIGN_CENTER"
					help="Align centered." />
				<option name="wxALIGN_RIGHT"
					help="Align right." />
				wxALIGN_LEFT
			</property>
			<property name="cell_vert_alignment" type="option"
				help="Default vertical alignment of cell values.">
				<option name="wxALIGN_TOP"
					help="Align top." />
				<option name="wxALIGN_CENTER"
					help="Align centered." />
				<option name="wxALIGN_BOTTOM"
					help="Align bottom." />
				wxALIGN_TOP
			</property>
		</category>

		<category name="Columns">
			<property name="col_label_values" type="stringlist"
				help="List of column labels." />
			<property name="default_col_size" type="int"
				help="Sets the default width for columns in the grid. Ignored unless a positive value is set.">-1</property>
			<property name="autosize_cols" type="bool"
				help="Automatically sizes all columns to fit their contents. Ignored if default_col_size is set to a positive value">0</property>
			<property name="drag_col_move" type="bool"
				help="Allow moving columns by dragging.">0</property>
			<property name="drag_col_size" type="bool"
				help="Allow sizing columns by dragging.">1</property>
			<property name="col_label_size" type="int"
				help="Height of column labels. If height equals -1 then height is calculated automatically so that no label is truncated.">-1</property>
			<property name="col_label_horiz_alignment" type="option"
				help="Horizontal alignment of column label text.">
				<option name="wxALIGN_LEFT"
					help="Align labels left." />
				<option name="wxALIGN_CENTER"
					help="Align labels centered." />
				<option name="wxALIGN_RIGHT"
					help="Align labels right." />
				wxALIGN_CENTER
			</property>
			<property name="col_label_vert_alignment" type="option"
				help="Vertical alignment of column label text.">
				<option name="wxALIGN_TOP"
					help="Align labels top." />
				<option name="wxALIGN_CENTER"
					help="Align labels centered." />
				<option name="wxALIGN_BOTTOM"
					help="Align labels bottom." />
				wxALIGN_CENTER
			</property>
		</category>

		<category name="Rows">
			<property name="row_label_values" type="stringlist"
				help="List of row labels." />
			<property name="default_row_size" type="int"
				help="Sets the default height for rows in the grid. Ignored unless a positive value is set.">-1</property>
			<property name="autosize_rows" type="bool"
				help="Automatically sizes all rows to fit their contents. Ignored if default_row_size is set to a positive value">0</property>
			<property name="drag_row_size" type="bool"
				help="Allow sizing rows by dragging with the mouse.">1</property>
			<property name="row_label_size" type="int"
				help="Width of row labels. If width equals -1 then width is calculated automatically so that no label is truncated.">-1</property>
			<property name="row_label_horiz_alignment" type="option"
				help="Horizontal alignment of row label text.">
				<option name="wxALIGN_LEFT"
					help="Align labels left." />
				<option name="wxALIGN_CENTER"
					help="Align labels centered." />
				<option name="wxALIGN_RIGHT"
					help="Align labels right." />
				wxALIGN_CENTER
			</property>
			<property name="row_label_vert_alignment" type="option"
				help="Vertical alignment of row label text.">
				<option name="wxALIGN_TOP"
					help="Align labels top." />
				<option name="wxALIGN_CENTER"
					help="Align labels centered." />
				<option name="wxALIGN_BOTTOM"
					help="Align labels bottom." />
				wxALIGN_CENTER
			</property>
			<property name="tab_behaviour" type="option">
				<option name="Tab_Stop"
					help="Do nothing. This is the default." />
				<option name="Tab_Wrap"
					help="Move to the beginning of the next (or the end of the previous) row." />
				<option name="Tab_Leave"
					help="Move to the next (or the previous) control after the grid." />
				Tab_Stop
			</property>
		</category>

		<event name="wxEVT_GRID_CELL_LEFT_CLICK" class="wxGridEvent"
			help="The user clicked a cell with the left mouse button." />
		<event name="wxEVT_GRID_CELL_RIGHT_CLICK" class="wxGridEvent"
			help="The user clicked a cell with the right mouse button." />
		<event name="wxEVT_GRID_CELL_LEFT_DCLICK" class="wxGridEvent"
			help="The user double-clicked a cell with the left mouse button." />
		<event name="wxEVT_GRID_CELL_RIGHT_DCLICK" class="wxGridEvent"
			help="The user double-clicked a cell with the right mouse button." />
		<event name="wxEVT_GRID_LABEL_LEFT_CLICK" class="wxGridEvent"
			help="The user clicked a label with the left mouse button." />
		<event name="wxEVT_GRID_LABEL_RIGHT_CLICK" class="wxGridEvent"
			help="The user clicked a label with the right mouse button." />
		<event name="wxEVT_GRID_LABEL_LEFT_DCLICK" class="wxGridEvent"
			help="The user double-clicked a label with the left mouse button." />
		<event name="wxEVT_GRID_LABEL_RIGHT_DCLICK" class="wxGridEvent"
			help="The user double-clicked a label with the right mouse button." />
		<event name="wxEVT_GRID_CELL_CHANGED" class="wxGridEvent"
			help="The user changed the data in a cell." />
		<event name="wxEVT_GRID_SELECT_CELL" class="wxGridEvent"
			help="The user moved to, and selected a cell." />
		<event name="wxEVT_GRID_EDITOR_HIDDEN" class="wxGridEvent"
			help="The editor for a cell was hidden." />
		<event name="wxEVT_GRID_EDITOR_SHOWN" class="wxGridEvent"
			help="The editor for a cell was shown." />
		<event name="wxEVT_GRID_COL_SIZE" class="wxGridSizeEvent"
			help="The user resized a column by dragging it." />
		<event name="wxEVT_GRID_ROW_SIZE" class="wxGridSizeEvent"
			help="The user resized a row by dragging it." />
		<event name="wxEVT_GRID_RANGE_SELECT" class="wxGridRangeSelectEvent"
			help="The user selected a group of contiguous cells." />
		<event name="wxEVT_GRID_EDITOR_CREATED" class="wxGridEditorCreatedEvent"
			help="The editor for a cell was created." />
	</gen>
</GeneratorDefinitions>)===";
